video_id,chunk_id,text,subject
10,10_14,the ministry of justice and it wa in some case it wa specific to different business area so for example in court it an absolute red line in term of technologymaking judgment thats just not a line were willing to cross and therefore it i guess relatively easy in that space to say this is where the line is i think it actually harder in other space to say this is where the line is but those are the conversation we need to be having i think it introduced sort of touched there on a little bit of almost like a bit of a digital divide and not losing the human skill that we have if we rely solely on technology actually you could see they talk about thing like ai and technology being able to bring that digital divide together but there also an opportunity to challenge the earth a bit of a fear that it could expand that divide because like we all use the calculator and im terrible at mental arithmetic we dont want to lose the ability that we have just because we then become solely reliant on,Digital & AI transformation in the Public Sector
10,10_15,use the calculator and im terrible at mental arithmetic we dont want to lose the ability that we have just because we then become solely reliant on technology absolutely i think thats a real progress definitely i think another area thats interesting with this sort of human and the artificial intelligence is the sort of the bias around ai i dont know if youve seen the latest tv advert with dove i dont know i havent actually it really powerful because they sort of type in to the chat but give me a photo of a beautiful woman and so of course it generates what it think is a beautiful woman and then you can put in the information say give me an image of what is a dove beautiful woman and thats when you get back the image and their different size different colour and it suddenly becomes more representative and i think there is a fear though on what that bias is if we dont put in the right data especially for you i think with that customer first mentality and looking at your citizen,Digital & AI transformation in the Public Sector
10,10_16,on what that bias is if we dont put in the right data especially for you i think with that customer first mentality and looking at your citizen experience you have to get that data right you dont want to put anything bias into your system because youre then going to be getting the right user experience out absolutely agree but i also think that there is so much data that sits across government that is it subjective because again going back to m o j case note and i say just damage in health adult are case note so there lot of that type of information in data that sits in government and you need to that information and that information will likely have some level of bias in it because a human we all have a level of bias so it about how do you make sure that youre not amplifying that bias and i think thats hard and i think we only find that by experimenting safely but experimenting to see what level of kind of accuracy we get when we test ai in different scenario and then we have to make,Digital & AI transformation in the Public Sector
10,10_17,by experimenting safely but experimenting to see what level of kind of accuracy we get when we test ai in different scenario and then we have to make decision on whether that level of accuracy is good enough and whether it good enough for public service particularly definitely i think thats where ai ha a very positive force it creating this curiosity there such curiosity about what we can do with technology and i think thats possibly the biggest opportunity that it ha given a lot of u at the moment yeah the other thing that i went to speak to some policy people of my old job and they said come and speak to u do you know about ai im sorry i cant come and speak to about ai but ill also speak to about some other thing and they asked the question of how do you think what impact should you think this will have on the way that we work and for me it wa an opportunity to say actually i think that we should be sat side by side building this technology i mean we should be doing that anyway with,Digital & AI transformation in the Public Sector
10,10_18,it wa an opportunity to say actually i think that we should be sat side by side building this technology i mean we should be doing that anyway with technology but particularly with genie ai where you are testing and retesting and fine tuning the technology i think it brings operational colleague policy colleague digital colleague closer together and i think that can really be a good thing definitely and do you think it made are you talking about sort of legacy technology and sort of government government department have been around for a long time do you think it enabled sort of the younger generation to look at your role to look at what youre doing and actually see it a quite a more exciting than perhaps they used to and youre sort of seeing that sort of a sort of interest in getting these new digital skill and joining your workforce thats an interesting question i dont know you know i think that what do i think i think that when people look at government they still have an image of,Digital & AI transformation in the Public Sector
10,10_19,an interesting question i dont know you know i think that what do i think i think that when people look at government they still have an image of what thats like in or civil service and they still have an image of what thats like and so i think it hard for people to kind of connect to that imagine and see themselves in those role so i think where the thing that is more likely to influence people is where we are talking to people and they can see where normal human being and actually and were grappling with some quite interesting problem that for me that for me is more powerful than any kind of individual technology and getting people excited about these type of role definitely or not youre a perfect face for it i mean you talk so eloquently and yeah it quite inspiring to hear about your vision so thank you so much gina for joining u on the podcast again because obviously we have spoken to in the past and hopefully speak to you again soon thank you thank you for listening to the,Digital & AI transformation in the Public Sector
10,10_20,u on the podcast again because obviously we have spoken to in the past and hopefully speak to you again soon thank you thank you for listening to the servicenow uk and i executive circle podcast if youve enjoyed this or any of the other episode of this podcast series please do take a moment to rate or review u on your podcast platform of choice wed love your feedback finally im cat finch the host of the servicenow uk and i executive circle podcast thank you again for listening and speak with you again soon,Digital & AI transformation in the Public Sector
11,11_0,hello and welcome to the servicenow executive circle maximising the minute on ai miniseries in each episode of this new miniseries in ai we take a topic or theme from our discussion from our brilliant executive circle guest and were talking to adam spearing the head of ai innovation at servicenow who can deepdifurder into that topic welcome adam thank you for having me again so a topic that keep coming up and is actually being talked about a a trend for next year but i know that servicenow is really talking about it and i know that were already doing it is a genetic ai now what is it so the way i think about a genetic ai is imagine having lot of bot right everybodys most people are familiar with a bot and a bot doe something if you can get bot talking to each other then you can get them to make some decision so let say youve got a bot that can look at ticket for it and youve got a bot that can look at provisioning of technology if you get those two bot talking to each other they can,Maximising the Minutes on AI: Agentic AI and the Next Wave of Business Transformation
11,11_1,can look at ticket for it and youve got a bot that can look at provisioning of technology if you get those two bot talking to each other they can say well ive got a problem here oh and the other one can say well ive got a problem here is my problem caused by your problem oh well then let see if we can solve our problem together and thats with the concept in very crude term of what a genetic ai is about so this is where youre going to start to see the opportunity for different technology to interact with each other so let say youve got a microsoft microsoft copilot and now assist interaction together is actually a genetic technology it two ai technology working off of each other it now assist saying to copilot hey this user had a failure of their it the other week and by the way the license theyve got for that software theyre not using and copilot going to the user and going hey did you know that youve got some software youre not using and your laptop keep failing you do a new one so,Maximising the Minutes on AI: Agentic AI and the Next Wave of Business Transformation
11,11_2,copilot going to the user and going hey did you know that youve got some software youre not using and your laptop keep failing you do a new one so thats an example of a genetic technology very simply and so with that move business away from being reactive to being quite predictive like oh ive spotted a few trend here like those license i can actually preempt the next 100 people who are going to come to me and say my license run out because actually i already know now from that example so it kind of like you can imagine each bot like a domino effect each bot will knock onto the next one the next one yeah exactly exactly and actually you leave me onto one of the thing that im most excited about a well is this thing called knowledge graph so using the bot and using this genetic technology we can augment system to work off of each other right now were a workflow engine we happen to show up a an itsm tool an hr tool a help desk tool a wrist tool etc etc but we are fundamentally a workflow,Maximising the Minutes on AI: Agentic AI and the Next Wave of Business Transformation
11,11_3,now were a workflow engine we happen to show up a an itsm tool an hr tool a help desk tool a wrist tool etc etc but we are fundamentally a workflow platform driven by ai and there lot of uniqueness in our what we do but when you start thinking about what we actually know we know so much about where you are what youre working on what your laptop say what software youre using and so what that mean is that when you get to that mass personalization using something like the knowledge graph we can actually sit down and say hey youve just called in because i dont know i had banked this up today wa oh 70 of our call to the help desk are password and recess im like really still yes they are okay well this technology can say to you well i know youve got a mac so im not going to show you the window version of that password reset ill show you the version thats just for you oh and by the way i know you havent done your password reset this isnt the third time you failed to do it im going to,Maximising the Minutes on AI: Agentic AI and the Next Wave of Business Transformation
11,11_4,the version thats just for you oh and by the way i know you havent done your password reset this isnt the third time you failed to do it im going to recommend the call for you so thats where you use thing like the knowledge graph to personalize the experience for the consumer for the employee but then a a business you can say well hang on a minute why have i got 5000 license of this and only three of them being used why am i paying for that why am i how many people are actually working on this project and that that with the knowledge graph then suddenly becomes a really insightful use then you can start to getting to the unknown right the unconscious incompetence area where the technology can go i keep seeing this issue come up i keep seeing this issue come up every time i see this issue you tell me to do that do you want me a the ai technology to change your policy oh yes please click ive changed the policy the incident have come down because everybodys happier because now the policy,Maximising the Minutes on AI: Agentic AI and the Next Wave of Business Transformation
11,11_5,to change your policy oh yes please click ive changed the policy the incident have come down because everybodys happier because now the policy match reality and thats an evolution i think that is going to be very exciting in 2025 it amazing how many time even human being are like oh if so and so had spoken to so and so we wouldnt be in this predicament precisely and so do you see obviously the example youve just given were very much password reset and thing like that but i mean im thinking of these thing that always come up in our local area there a lot of road work around where we are because theyve just dug up the road for one water pipe and then the following week theyre digging up the road for electricity imagine if they spoke to each other do you see those kind of application like if an organisation sort of had that you know one bot thats looking after the water pipe maintenance infrastructure and the other bot thats looking after the electricity infrastructure oh well just dig,Maximising the Minutes on AI: Agentic AI and the Next Wave of Business Transformation
11,11_6,thats looking after the water pipe maintenance infrastructure and the other bot thats looking after the electricity infrastructure oh well just dig it up once wouldnt that be cool yeah so thats a great example of it on a business to business environment yes because when youre running a business and you think about all the thing you do you repeat too many thing time and time again oh were running an enablement session for team abc and next week were running an enablement session for team abc well why dont we do one enablement session for team abc and actually do it once and do it properly so there are lot of business to business example of where the technology can help with the bot to bot conversation the agentic conversation to simplify and make the process run smoother okay i mean ive seen example of well ive seen example of organization whose expense management process where they have different technology take people three or four hour to log an expense claim even today right now,Maximising the Minutes on AI: Agentic AI and the Next Wave of Business Transformation
11,11_7,whose expense management process where they have different technology take people three or four hour to log an expense claim even today right now with agentic technology you can remove all of the unnecessary out of that and simplify and streamline just a one example right and there load of area if youre running a business you know where the pocket are probably not when youre sitting in the csuite but i guarantee you the people who are doing the doing know where those issue are and by freeing them up and allowing the agentic technology to then help them iterate you can really make some fundamental change and were all looking for productivity gain weve been looking for those ever since you know cain wrote that paper and then many year ago nearly over 100 year ago weve been elusive productivity gain and i think finally were able to unlock a lot of those for everybody well thats fascinating and finally youve actually managed to explain it in a way that i get hopefully i listen is going to,Maximising the Minutes on AI: Agentic AI and the Next Wave of Business Transformation
11,11_8,lot of those for everybody well thats fascinating and finally youve actually managed to explain it in a way that i get hopefully i listen is going to understand i think thats fascinating and it not that complicated honestly we put this gloss over the fund of this technology sometimes just to create this allure that were unique and special technology is actually quite straightforward if you just take the time to learn it so obviously youre speaking to a number of organisation around europe around the globe other than agentic ai being big next year are there any sort of other common similarity and trend and thing that you see coming up yeah no i think one of the fascinating thing wa in 2023 2023 2024 end of 2023 beginning of 2024 we saw a lot of the hype a lot of oh we all need ai we all need ai woo and then we got into this cycle of taking the technology and trying to find the problem and that created a lot of frustration and a lot of er why is it not delivering and i think were coming,Maximising the Minutes on AI: Agentic AI and the Next Wave of Business Transformation
11,11_9,the technology and trying to find the problem and that created a lot of frustration and a lot of er why is it not delivering and i think were coming to that point where organisation are going to hang on a minute let use this let deploy this technology in the way weve always done it let look for the use case look for the roi build the fundamental and let build this a a business case and we saw during that period a well this kind of er outburst of were going to build our own language model right and everybodys suddenly going actually thats probably not such a good idea in my 30 year of technology build ha never actually been the most cost effective way to do it versus the commercial technology that are available for lot of reason and so what a we go into 2025 i am very excited about agentics im very excited about this knowledge graph concept and the ability for u to personalise experience across the organisation for everybody but also im very bored by the fact that a lot of the,Maximising the Minutes on AI: Agentic AI and the Next Wave of Business Transformation
11,11_10,concept and the ability for u to personalise experience across the organisation for everybody but also im very bored by the fact that a lot of the organisation have got their head straight on their strategy theyre thinking about their governance theyre thinking about the suite of technology theyre going to use theyve realised it not just one were very fortunate that in many most of those instance are unique offering put u a a core technology for doing that and i think theyre now starting to understand how to capitalise on this so we will achieve more in the long term than we could possibly believe even though were slightly frustrated in the short term with this technology and do you see any particular challenge that are still arising obviously have had to overcome the challenge of just the general excitement of ai what do i do with it any other challenge that you see sort of coming yeah the one that slightly keep me awake at night is the devolved responsibility where at the very,Maximising the Minutes on AI: Agentic AI and the Next Wave of Business Transformation
11,11_11,it any other challenge that you see sort of coming yeah the one that slightly keep me awake at night is the devolved responsibility where at the very beginning it wa the csuite garing yes yes yes yes let go let go and now theyre kind of oh well im done with that yet and theyve got to stick with this because this isnt a quick flick of switch and it done and this isnt a oh it a techie project to give it to the it team this ha to remain if you want to capitalise on the opportunity this ha to remain a a board level agenda item because it not just about what are we using the technology to do it about how were enabling our people how were controlling our data and our governance to make sure we keep the csuite out of jail that it not leaking off somewhere we dont want it to go accidentally so there a whole plethora of thing we need to do and then the opportunity for the csuite is well how can i rebuild my business if youre a ceo if you sat down with a clean piece of paper and said well how,Maximising the Minutes on AI: Agentic AI and the Next Wave of Business Transformation
11,11_12,the opportunity for the csuite is well how can i rebuild my business if youre a ceo if you sat down with a clean piece of paper and said well how would i build this business if henry ford hadnt set up the organisation structure when he did how would my business look this is the opportunity youve got to build the business how you would design it not how henry ford created the organisation structure all those year ago and i guess it moving away from just thinking about it oh it a digital transformation it a digital transformation it a business transformation with aspect like gni automation data a part of that transformation and you get that clear then that go on for year and year this is a longterm strategy of business transformation this is not just a onehit and im done oh i cant tell you the number of customer im talking to and this epiphany they have of what hang on so rather than u talking to you every six or nine month and seeing what youre doing we need to talk with you every,Maximising the Minutes on AI: Agentic AI and the Next Wave of Business Transformation
11,11_13,epiphany they have of what hang on so rather than u talking to you every six or nine month and seeing what youre doing we need to talk with you every three month we need to look at what youre releasing because the product is coming out so fast and we need to say within 90 day what are we deploying in the next 90 day with one eye on what youre delivering in the next the following 90 day or with roi so that were in this constant virtuous cycle of being agile in how we adopt the technology a opposed to right well this year i think were going to use a b and c right it a 90day cycle youve got to be in to really capitalise and move a quick a the technology is i think a key point you just said is how we use a technology and you mentioned in a previous episode about digital skill thats going to be a big thing a well next year and it not just about hiring a many prompt engineer a you can possibly find this is about training people to be able to augment their role by having that understanding,Maximising the Minutes on AI: Agentic AI and the Next Wave of Business Transformation
11,11_14,hiring a many prompt engineer a you can possibly find this is about training people to be able to augment their role by having that understanding that critical thinking and analysis of what ai is serving them not necessarily needing the programming skill and i think thats something were going to see massively next year is that kind of understanding of what are the digital skill that my employee need and how can i provide that to them yeah and we saw this so many year ago there wa and it still ongoing this concept of a citizen developer right and it wa this battle between it and business where it saying citizen developer bad business saying citizen developer good because business want flexibility it want control of the data and i think in most organisation weve got to a happy balance between that if you get it right you can protect the data and give the citizen the freedom and flexibility and actually enhance the developer community for it without formal trained developer now exactly,Maximising the Minutes on AI: Agentic AI and the Next Wave of Business Transformation
11,11_15,and give the citizen the freedom and flexibility and actually enhance the developer community for it without formal trained developer now exactly the same a true with ai in my view in that we want our employee to be conversant to be comfortable to be competent in using the technology but what we dont want them to do is go off and do dumb thing and thats where i think a an organisation you have to say well what level of knowledge do i want to skill people up to yes im going to have llm engineer and im going to have machine learning engineer and phd scientist in my it group brilliant you need them but equally ive got an army of thousand of people who if i teach them to use the technology how the right way i can unleash huge amount of potential huge amount of potential but also using those people to help educate so looking at it from a bottom up a well it all well and good a being yes it a sea level a sea suite level strategy but the daytoday user of it they can source and find those,Maximising the Minutes on AI: Agentic AI and the Next Wave of Business Transformation
11,11_16,up a well it all well and good a being yes it a sea level a sea suite level strategy but the daytoday user of it they can source and find those process that need automated they can find those use case to share up and say do you know what this actually could save me this amount of my time imagine if we scaled it across the entire business yeah no and thats where i think when youre running you know to my mind i mean many year ive been doing digital transformation it climb one of the thing i talk about is whats your ideation strategy right because ideation doesnt come from one person or from a boardroom or from it the best ideation come from the people who are doing the challenge and solving the task the people on the front line so how do you bring them into your ideation how do you not have the suggestion box that get emptied into the waste basket once a quarter how do you have a process of ideation that embrace them when they see change happening driven by their idea and their,Maximising the Minutes on AI: Agentic AI and the Next Wave of Business Transformation
