video_id,chunk_id,text,subject
16,16_15,that it probably is talking about carrie i mean ha there been a great conversation but just kind of like wanting to end of anything else you want to add especially for our client will all prospect of really about studying off their journey any advice what a gift there yeah i say dont be afraid and start simple right look at those foundational principle you know organization like fidgetes who come in and help you get it right from the start rather than learning by making them stake and having to go backwards and fix thing so yeah come and come and talk to a partner try and get that conversation going use their knowledge of previous implementation to make sure that your implementation go well thank you so much for joining u today and also for u to be a great partner a well a a customer of service now this ha been really a great conversation yeah thank you very much for having me it been really good and thank you to all of our listener please subscribe and share if you like what you,Unlocking Service Operations with AI: Insights from Carey Blunt
16,16_16,yeah thank you very much for having me it been really good and thank you to all of our listener please subscribe and share if you like what you heard today and be sure for joining u for the next episode,Unlocking Service Operations with AI: Insights from Carey Blunt
17,17_0,hello and welcome to spm academy im deborah mcgrath principal product marketing engineer with servicenow and spm academy host joining u today were thrilled to have james ramsey director of outbound product management to discus and demo how servicenow can help you realize the potential of ai with spm and our ai capability youre going to hear about how it all work why it important and then see it in action in james demo then well wrap up by sharing some resource and some really important upcoming event so james ha a ton to cover today so let me quickly point out our safe harbor notice and then ill turn it over to james well most of what well be discussing and showing our feature that are currently available there may be forwardlooking statement that reflect the current belief of servicenow based on current information available your actual result may differ materially and should not be relied upon in making purchasing decision so with that id like to welcome james help u all become a,SPM Academy: Now Assist and AI Agents for SPM
17,17_1,result may differ materially and should not be relied upon in making purchasing decision so with that id like to welcome james help u all become a little smarter today about ai thank you deborah hi everybody im james ramsey part of the outbound product management team for strategic portfolio management so in today session what i thought wed do wed start out in looking into the strategic portfolio management and it rolling helping organization and helping you optimize the value of ai a you roll it out of a cushion organization and this is looking at ai in the larger picture whether thats ai on the servicenow platform or whether youre using ai on google microsoft et cetera how can you deliver that across your organization then were going to look specifically at how were putting ai to work with inside strategic portfolio management and ill give you a short demonstration around some of the capability weve delivered out the box and youll find within size doe undo at least and just before,SPM Academy: Now Assist and AI Agents for SPM
17,17_2,give you a short demonstration around some of the capability weve delivered out the box and youll find within size doe undo at least and just before we go im going to try and get five minute to give you a sneak peek of whats coming just around the corner with a yoke harmer at least so with that let get cracking so everybodys talking about ai everybodys looking to deliver an ai strategy across their organization and rightly so because ai is promising to solve all those complexity issue a were looking to drive change and innovation right the way across the enterprise and thats backed up by lot of different independent survey where were seeing lot of executive seeing the transformation effect there so gni i will have through 2027 but if you think about 2024 wa potentially in most organization did their to into ai and how it could be applied across their organization move fast forward into 2025 and it all about how can we ensure were getting a return on investment were going to deliver,SPM Academy: Now Assist and AI Agents for SPM
17,17_3,across their organization move fast forward into 2025 and it all about how can we ensure were getting a return on investment were going to deliver substantive value on our ai investment so for that we need to ensure that ai life up to the hype it delivers on it promise but the fact of the matter is looking at various different organization and certainly organization ive talked with over the last 12 80 month a lot feel theyre not really prepared in term of how they go about rolling out and adopting ai successfully across the organization and without successful adoption youre not going to get that return on investment and part of the problem there is the actual framework organization are looking to put in place in order to deliver ai across the organization how it allows them to roll it out but also how it allows it to track govern and ensure were not exposed to risk so what were going to look at first of all is spms rolling ensuring we get the value from delivering ai now we think,SPM Academy: Now Assist and AI Agents for SPM
17,17_4,ensure were not exposed to risk so what were going to look at first of all is spms rolling ensuring we get the value from delivering ai now we think about the building block you need to be successful in delivering your ai strategy where you need to have a vision what are we looking to achieve and one of the target where were going to look to put in place in order to measure success we need them to identify all those ai use case that we want to roll out across the business we want to bring them together we need to objectively assess them prioritize them and then from that move forward in term of planning out what that ai transformation roadmap look like and then looking in term of how we deliver all those initiative a were doing that weve got to link in with our enterprise architecture discipline we need to understand where ai is being deployed across the organization so that we can ensure we monitor any risk and we always stay compliant and ultimately a we go through this endtoend,SPM Academy: Now Assist and AI Agents for SPM
17,17_5,deployed across the organization so that we can ensure we monitor any risk and we always stay compliant and ultimately a we go through this endtoend process weve got to ensure were optimizing the value that ai is providing we need to be understanding what the value is being delivered and if we need to pivot plan we need to be able to do that now if you think about those five step it all scream the need for strategic portfolio management and thats because an ai transformation is just like any other transformation or strategic initiative that go across your organization and we know the importance of having a strategic portfolio management approach in the successful delivery of those strategic initiative so through capability like the strategic planning workspace which well see later on the ability to define what those priority are the thentoroam map our ai strategy and then track how were actually delivering on those priority and the value being created all through spm and we all know,SPM Academy: Now Assist and AI Agents for SPM
17,17_6,map our ai strategy and then track how were actually delivering on those priority and the value being created all through spm and we all know through spm we can deliver working lot of different way whether it traditional project agile work but if you think about an ai perspective lot of thing happen very quickly lot of little experiment may be happening in term of different ai technology being tested out across the organization before we do a full roll out these experiment are typically driven by ai incubation team and thats a perfect use case for collaborative work management which is a new capability we introduced in strategic portfolio management the ability to build bring those incubation team together very quickly to plan out what we need to do inside the experiment and also to expose that experiment onto our roadmap and any dependency it may have in thing we want to deliver in the future and finally with that link between spm and enterprise architecture we have that ability then,SPM Academy: Now Assist and AI Agents for SPM
17,17_7,it may have in thing we want to deliver in the future and finally with that link between spm and enterprise architecture we have that ability then to map and model how were looking to utilize ai across the organization both in our current state and our future state model by tying together enterprise architecture to strategic planning were able then to have a better view of our risk posture and ensure that were going to achieve compliance so that wa just quick insight in term of the importance of applying an spm approach to enable you to maximize the value of your ai strategy a you want to deliver it now were going to look at how were putting ai to work within strategic portfolio management now one of the key element and one of the key strength of service to our strategic portfolio management is it underpins the endtoend lifestyle from strategy through strategic planning portfolio planning all the way through to delivery and ultimately value realization and through that endtoend,SPM Academy: Now Assist and AI Agents for SPM
17,17_8,strategy through strategic planning portfolio planning all the way through to delivery and ultimately value realization and through that endtoend process there some key stakeholder that engage in utilising strategic portfolio management from business leader through pmo to project resource manager development team etc what were looking to do by applying now assist to the endtoend spm life cycle is to enable each one of those key persona to gain benefit through ai to make them more productive to help them make better decision and ultimately to fast track value through that endtoend lifestyle now you may have seen similar diagram in the past this is something i used to depict our endtoend cycle on how we looked at transform our strategy into delivering value whether it related to the business or is related to technology from strategic planning to portfolio planning to that delivery of work now what weve done through the zanadir release is look to apply ai across that endtoend life cycle,SPM Academy: Now Assist and AI Agents for SPM
17,17_9,to portfolio planning to that delivery of work now what weve done through the zanadir release is look to apply ai across that endtoend life cycle and provide some specific use case for those key persona a we look across into our life cycle from business leader all the way through to project manager and development team so whether it looking at how we get more demand from across the organisation through compositional demand whether it helping our product manager or quickly assess the feedback or it helping those various team collaborate and be more effective in managing their documentation with some of our documentation so lot of different use case already there sanded out the box now what i thought wed do at this point let call out a powerpoint and were going to actually go and look in term of what that look like within the solution but this is my zanadir release and first of all ive come to the floor you portal because ive got a new demand that i want to submit and rather than me,SPM Academy: Now Assist and AI Agents for SPM
17,17_10,this is my zanadir release and first of all ive come to the floor you portal because ive got a new demand that i want to submit and rather than me going through and clicking on a form and filling in a form what i can do is actually engage with now assist directly and i can say i have the demand and what now assist is going to do is look for all the different type of submission i might want to make and across an organisation you may define lot of different type of request that can be made so i can see here ive got a number of thing which a i might under create demand or maybe something specific around hr content i want to add to our training syllabus i might have some generic type of work request i want to make well let say im going to look at creating a demand i can start that request and rather than me being presented with a form what now assist is going to do is ask me a series of question so it going to take the user through the demand and ask him all the thing that are pertinent,SPM Academy: Now Assist and AI Agents for SPM
17,17_11,now assist is going to do is ask me a series of question so it going to take the user through the demand and ask him all the thing that are pertinent to that type of request so let say we want to do auto categorisation or product feedback and a i enter my information now assist will then look at why do we need that the new product manager to react faster and im taking through those various question i can even have thing that a im adding in my request im going to align this to the various key strategic initiative so this is aligned to customer centric product innovation im going to say this is probably going to be of medium level effort and then what ill do just for time today im going to skip some of the nonmandatory question around cost and around benefit and then what now assist will provide me with is a summary of what ive entered in term of asking those question now ive made a mistake there in term of the level of effort so i can say i want to make a change and in natural language,SPM Academy: Now Assist and AI Agents for SPM
17,17_12,of asking those question now ive made a mistake there in term of the level of effort so i can say i want to make a change and in natural language i can say change size to large so now assist will go away and make that change so we can see in term of the level of effort thats now changed to large im happy with that im going to submit it and thats the demand now in my demand pipeline so that enables u to get everybody across the organization participating in that demand intake process because it making it easier for people to use now if im a product manager i can be in a strategic planning workspace and using our feedback capability and one of the thing i do on a daytoday basis i get lot of email from customer around feedback around our product so in product feedback this is giving me visibility around the product im looking after in my business customer portal i can see the category of feedback ive received where that feedback ha come from ive even got thing like sentiment analysis to,SPM Academy: Now Assist and AI Agents for SPM
17,17_13,customer portal i can see the category of feedback ive received where that feedback ha come from ive even got thing like sentiment analysis to look at now everybodys talking about ai and how we get ai into product so i can drill down into that section i can look at all the ai related feedback and if you think about the typical whirlwind today id have to look at all of those email individual go in read them then assess them and decide what i want to do a very timeconsuming process what i can do here i can quickly look at selecting all the feedback item im looking at i can click on my summary button and what now a system will now do is do a summary of all of those feedback item bring me back a bulleted list of the thing i need to know about and immediately then i can put that information from now assist into action so i can link it to a product idea or i could click demand directly or an epic or a project or whatever it is and drive forward an action thats information from now assist if,SPM Academy: Now Assist and AI Agents for SPM
17,17_14,idea or i could click demand directly or an epic or a project or whatever it is and drive forward an action thats information from now assist if we move forward into the process let look in term of enterprise agile planning now throughout that into process you will see on the slide actual previously the ability to add ai in the context of document so right the way across to do portfolio management weve introduced what we call the doc tab so this is enterprise agile planning im looking at the agile work from my business customer portal team and i can see all the epic currently being worked on a i drill into doc i can see ive got a couple of document there one of which is release note a i drill into that document this will give me information around whats in those release note and i can see ive been at message to actually shorten the introduction paragraph and with doc these are fully collaborative so other people can come in and collaborate around creating these document and we can,SPM Academy: Now Assist and AI Agents for SPM
17,17_15,paragraph and with doc these are fully collaborative so other people can come in and collaborate around creating these document and we can reference other information on the platform like referencing record et cetera now what i could do i could pick the paragraph up i could look at now assist and i could click on short summarize or elaborate or if i want to summarize the entire document i can simply click on summarize and that will provide me a summary of the overall release note document which i can take that test and actually put in the document should i wish to do so now doc is available right the way across spm inside the project workspace and inside the strategic planning workspace inside product feedback and that use of ai is available right the way across now the final use case were going to look at now is something we rolled out in the november store release it called the project insight email so if im a project manager working inside the project workspace and im looking at my,SPM Academy: Now Assist and AI Agents for SPM
17,17_16,the november store release it called the project insight email so if im a project manager working inside the project workspace and im looking at my project ive got the ability to set up an email project summary and what i can do here is set a schedule by which i want this summary to be created and what will happen a that email is scheduled now assist will then generate me the content relating to whats happening in the project so just a an example what im just going to do here is just bring up an example of what that email look like and we can see it broken down into a series of section and what now assist will do is generate this format of email and with inside each section well provide information and link to various element of the project give me insight to whats happening with inside my project without me actually having to come into service now to understand whats going on and should i want to action anything that the email is telling me ive got the link ill take me back into the,SPM Academy: Now Assist and AI Agents for SPM
17,17_17,service now to understand whats going on and should i want to action anything that the email is telling me ive got the link ill take me back into the solution so a very powerful way of providing proactive insight for project manager utilising now assist now let go back to the powerpoint and what were going to talk to now is whats coming whats around the corner and what im going to introduce now is something were looking to roll out with inside your karma around ai agent so very much where weve been in 2024 is around phase three of ai around conversation or workload and you saw through those example that i showcase quickly there where the human is actually engaging with now assist asking now assist to perform action in order to help that persona do their particular work now fast forward into 2025 and everybodys talking about a genty ai and the use of ai agent this promise to be the most transformational thing to happen to the spm life cycle for 30 year and ive been working in spm for,SPM Academy: Now Assist and AI Agents for SPM
17,17_18,the use of ai agent this promise to be the most transformational thing to happen to the spm life cycle for 30 year and ive been working in spm for all of that time it a really exciting prospect where we can have agent proactively working and helping facilitate persona right away across the end of the process so what doe that actually look like so from an spm standpoint what were looking to do is provide ai agent that are persona driven so whether the target is towards an executive or portfolio owner or a project a resource manager were effectively looking to create these agent to actually perform specific activity or to understand specific use case and whats exciting about them is youre effectively creating a system of agent those agent are going to work together a a team in order to help analyze activity provide suggestion and recommendation to the persona and then actually take action based on what the human suggest need to happen now if we look at what the structure of an ai agent,SPM Academy: Now Assist and AI Agents for SPM
17,17_19,to the persona and then actually take action based on what the human suggest need to happen now if we look at what the structure of an ai agent look like im going to take you in a moment and give you a sneak peek of the ai agent studio now the structure is essentially we define a use case what is the business problem or the activity were looking to address and were going to provide some natural language description of what that look like what well then do is define a trigger of what will kick off agent looking at this particular use case now it could be user driven but the power of ai agent is in that trigger beam machine driven something happening in the database a record being created a field being updated an api call whatever that may be and from that trigger that will kick into what we call the ai agent orchestrator now what the ai agent orchestrator will do will identify from that trigger if this particular use case irrelevant and then from that will look then to trigger off the,SPM Academy: Now Assist and AI Agents for SPM
17,17_20,orchestrator will do will identify from that trigger if this particular use case irrelevant and then from that will look then to trigger off the specific ai agent needed to actually work on solving that particular business problem now the ai agent themselves think about them a having specific job to do and again ill show you an example in a moment but what theyll do is one of them might be to collect information one might be presenting information back to the persona one might be to actually take an action like create a record or something like that now the key element of those ai agent a theyre looking to do their task their activity will be defined through a prompt and then associated with those agent will be what we call tool and these tool of what the agent will utilize to interact with information whether it now assist skill or whether it script a we do in a state business or using workflow using thing like raguay were looking at different thing with inside documentation those,SPM Academy: Now Assist and AI Agents for SPM
17,17_21,it script a we do in a state business or using workflow using thing like raguay were looking at different thing with inside documentation those tool will be utilized by the agent to help and perform that task in order to help u solve that business problem now let quickly jump in and see what that look like so now were taking you into the ai agent studio so a i say this is now something well be rolled out with inside your carman the example im going to take you through now are just example ive created a weve gone through but sure sort of the direction of travel that were looking to do from an ai agent perspective within size strategic portfolio management so the example im going to use is around application rationalization because this is one thats got a lot of people excited in various different industry sector the first step is we define our use case so a i can see one use case application rationalization using ai agent to automatically assist architect in rationalizing their,SPM Academy: Now Assist and AI Agents for SPM
17,17_22,define our use case so a i can see one use case application rationalization using ai agent to automatically assist architect in rationalizing their business application so i drill into my use case weve got a description of what the use case is and we got some ai instruction in a basic prompt telling me whats going to happen here in term of how this use case is going to happen so it going to be kicked off by an objective and objective and then what were going to ask it to do is identify the overall analysis of our business application portfolio to give u some cost information the next step will be then to identify some candidate to help u meet those cost target and then on approval were going to create some demand record now the trigger we define in this case is just a simple bigger based on some information from a kpr and an okr within size spm where weve got a changing target so it going to recognize that change in target which will then kick off this particular use case but a i say,SPM Academy: Now Assist and AI Agents for SPM
