video_id,chunk_id,text,subject
5,5_6,know what half an hour ha gone by and nothing ha actually been helping you right it very good yeah yeah weve all had that common experience yeah it frustrating right and you get the same experience kind of with some of these chat application a well especially when it not alive especially when it a live person rather and then go through a script and they cant deviate from a script imagine now you have an intelligent bot and when you speak to it it then say okay well have you rebooted your router a an example and you say no and it come back and say would you like me to reboot your router okay sound like a good idea yes then it go ahead and reboots your router it know when the router ha been rebooted and say okay can you please try again and let me know if the issue ha been resolved and so right then and there you can say yes or no if you say yes it might then go ahead and do another action this is where the agent aspect of ai come in this intelligent automation and then it go ahead and,AI and Business Agility: Enhancing Human Intelligence
5,5_7,yes it might then go ahead and do another action this is where the agent aspect of ai come in this intelligent automation and then it go ahead and close the ticket if you say no well then it will know what do we do next to troubleshoot your problem it may ask you more clarifying question and based upon all this wealth of information that we have about how to troubleshoot problem we are going to get better response also perhaps this is not the first time you called in most chatbots if theyre not intelligent will not know that you just called u called last week but this time it say well you called yesterday about this is this the same problem exactly knowing the context right the history right knowing the context is really great so i think there is a way that we can really improve customer service using ai and then having people so when you really need to speak to a person they can actually spend quality time with you and theyre not focusing on the routine problem that are time,AI and Business Agility: Enhancing Human Intelligence
5,5_8,when you really need to speak to a person they can actually spend quality time with you and theyre not focusing on the routine problem that are time consuming to respond to but are easily automated and for customer to feel better about their interaction especially a were able to more humanize ai and perhaps you see an avatar of a person acting a an agent perhaps youre even speaking to it in the future it not very far off right now the main interface ha been texted with the chatbot but i imagine that it will be much more voice interaction with bot and feeling like youre speaking to a person rather than to an impersonal bot sure when weve seen it with alexa and siri right weve gone that direction so just now a matter of closing that gap and i agree it probably going to become the more common interface rather than typing thing out and so it really what you mentioned wa it really having that credibility too being able to trust and it not just some script that youre being read back to from,AI and Business Agility: Enhancing Human Intelligence
5,5_9,really what you mentioned wa it really having that credibility too being able to trust and it not just some script that youre being read back to from an agent maybe a live agent and you said that we can actually also harvest from that in term of the data the sentiment of course we can analyze this in real time a well and so we can really trust what were being told it engaging but were also collecting and a you said figuring out behind the scene whats the next best action what do we do next a this dialogue continues so and then were letting human really work and add value where human do the best work right right so removing some of that repetitive inquiry and really getting to the hard stuff where we need to put people so yeah it pretty fascinating how fast this is accelerated yeah and im optimistic about that you know every time weve had a new technology there always been fear that it going to take people job and while that may be true i think it will add job a much a it will,AI and Business Agility: Enhancing Human Intelligence
5,5_10,weve had a new technology there always been fear that it going to take people job and while that may be true i think it will add job a much a it will eliminate job so i think there will be a balance i think well better able to use the creative mind of people so if im calling in for customer service an example we can take them off the script and make and type thing into chat into general ai to ask question of their own source of internal information to get answer plus be able to query lot of source of information about maybe this ha happened before what did we do to resolve this in the past is this a totally novel problem you know is a system down can we we can check that quickly oh yeah there an adogenior area i mean there so many different thing that ai can augment human intelligence i dont see ai replacing human intelligence but it going to augment human intelligence,AI and Business Agility: Enhancing Human Intelligence
6,6_0,hello everyone welcome to a kbdi podcast we are reviewing a new set of topic and you will see a lot of focus on agentic ai starting this year so a you probably know service now is very deep into the three pillar that come to work for the fabric that combine all data from different discourse all your infrastructure and other data source then we combine it into creating action with ai agent and then creating assisted and autonomous workflow so a service now unravels this whole space we will be bringing you with new topic around this today i have an expert in observability and denika shae join u from san francisco hi denika who are you hi im good who are you yeah good good so this is going to be one of the first topic in this space or first episode were going to talk about were going to zoom into the observability world and what doe the ai agent mean for that so with that before we actually dive in denika why dont you quickly introduce yourself hi yeah hey everyone i am danica i am a,Creating an agentic AI framework for observability
6,6_1,ai agent mean for that so with that before we actually dive in denika why dont you quickly introduce yourself hi yeah hey everyone i am danica i am a product director in the ai ops team and i lead a bunch of initiative within ai ops one of them is building ai agent thats awesome yes i thats a great plug actually this observability is a part of a broader ai ops solution a well so both ai ops and observability go ahead and end so were going to get into both of those thing a little bit more today and a lot more in the future so a we dive in denika why dont you start with actually telling your perspective or what you think when you think of a gent dig when you think of ai agent what come to you what your mind when you think about this space i think for me it mostly like from a pragmatic sense it the access to information so ai agent make access to information access to complicated information much easier for any persona right i think with the rise of ai and llm what the most powerful,Creating an agentic AI framework for observability
6,6_2,access to information access to complicated information much easier for any persona right i think with the rise of ai and llm what the most powerful thing about them is that you dont really need to be taking a class or taking a course or being in that data storage system to be able to get this information and understand it the ai agent with the right access and with the right power can get that for you and then also summarize it in a way that make the most sense because it can understand how to explain it to different type of persona so i think thats to me one of the most powerful but also pragmatic way to use ai yeah thats interesting of course it make if you look at our customer landscape it make a lot of sense because a lot of our customer come from this operation or service desk environment right so they have different l1 l2 l3 type of responsibility and depending on their level they will be dealing with information a you said in a very different way or different or different,Creating an agentic AI framework for observability
6,6_3,of responsibility and depending on their level they will be dealing with information a you said in a very different way or different or different complexity of information is getting to them so ai agent can help them decide for them or simplify them for you for them okay thats great so let get into a little bit of the world that we live in and that is it operation and tell u a little bit about how do these agent ai or ai agent will help specifically enhance this it operation role yeah of course so the ai agent that im building within itam are ai agent that collaborate autonomously with third party ai agent from best of breed observability platform and so the problem that were trying to solve is that when an it operator is trying to triage and investigate an alert they really need to understand very quickly what is the impact and severity of this alert and which team and subject matter expert can they pull in to start the investigation and the complexity is that the critical,Creating an agentic AI framework for observability
6,6_4,severity of this alert and which team and subject matter expert can they pull in to start the investigation and the complexity is that the critical information to answer these two question resides in information silo it resides within service now but it also most elusively it resides in third party observability tool and to make the problem worse these it operator they dont often have access to these tool and when they do the learning curve for these tool is very high right theyre not built for it operator with more limited technical knowledge and so with ai agent you can sort of like break the barrier of access first of all because these ai agent can automatically contact a lot of these best of breed tool and they can also simplify the information and present it in a way thats very operatorfriendly and so with access to the information understanding and context of the information they can very quickly understand impact and severity a well a get enough like nugget of knowledge to,Creating an agentic AI framework for observability
6,6_5,understanding and context of the information they can very quickly understand impact and severity a well a get enough like nugget of knowledge to start the investigation with the subject matter expert yeah so i mean this is great because a lot of time when we talking to customer they just dont have one two or three tool theyve had sometimes half a dozen or even sometimes it doesnt tool right and it open more environment when youre monitoring your apps your microservices you probably have open source tool so it just help them right because it becomes almost a manager of manager kind of approach for a lot of work thats what itom doe today we embrace like an open system open ecosystem of observability and monitoring vendor we already connect with them via event management they can now set they can send event and alert into itom and from there thats sort of the entry point for the it operator and our agentic approach is exactly the same right in the world of ai agent we want to be the,Creating an agentic AI framework for observability
6,6_6,there thats sort of the entry point for the it operator and our agentic approach is exactly the same right in the world of ai agent we want to be the manager of the manager of ai agent we want to be the agent of agent and we want to help the it operator connect all of these vendor and to be able to facilitate a collaboration amongst ai agent and it doesnt really matter how the other agent the other third party agent are built right i mean they could be using their own llm they could be using their own data structure what matter is the data that come to service now is that the right yeah exactly and i think also to add on to that the information that they provide is very harmonious with the information that we already have so we can take the information that they have based off of like triceps log and metric and combine that harmoniously with the information that we have within the cmdb and sort of like the workflow and post mortems and like previous incident and alert and we can marry,Creating an agentic AI framework for observability
6,6_7,the information that we have within the cmdb and sort of like the workflow and post mortems and like previous incident and alert and we can marry that together and give the operator sort of like the best suggestion on what the next step should be yeah there also this brings up a good topic you mentioned cmdb so cmdb is a great way for becoming a providing a system of record for a lot of enterprise today but even if you dont have a great cmdb today or youre still in the process of building a quality cmdb this approach can still work right i mean they dont have to be bound down to say that you know i need to get my cmdb like 70 to ready state exactly it pretty much decoupled yeah and i think i mentioned this very briefly in the beginning that whole data strategy the service now ha around work for data fabric and the rapridb which is kind of pretty advanced way of processing your data that also help because you know we are not bound to a specific data structure or a specific format it,Creating an agentic AI framework for observability
6,6_8,of pretty advanced way of processing your data that also help because you know we are not bound to a specific data structure or a specific format it could be able to format it could be done in a any way that we can ingest that information into service now so then we also call it a knowledge graph which is kind of another way of thinking about how the relationship are built so thats great let go a little bit into do you want to give u specific scenario you know you are working right now in the middle of this huge development and we will see that our development being released in the coming month but if you take a specific use case do you want to walk down a specific use case with what youre building with some of the other agent yeah and so yeah and i think it always help to anchor around a very concrete use case and so the one that you know we see a lot when we work with a lot of ecommerce company enterprise company is that for example the alert that come into itom will first be say on,Creating an agentic AI framework for observability
6,6_9,we see a lot when we work with a lot of ecommerce company enterprise company is that for example the alert that come into itom will first be say on a application service called the payment service and so it the operator job to sort of understand when they see this alert for the payment service say it like the sla for availability is breached right normally it should be 95 it now 94 and so the operator really in a world without ai agent they need to figure out whats the impact and severity of the alert and who to pull in to start the investigation and so with ai agent now the operator can open now assist and automatically we can detect that okay this alert is from vendor xyz but given we have an integration with them our ai agent will just autonomously reach out to their ai agent to say hey can you tell u more about the alert what other entity are you seeing being impacted do you have supporting metric to sort of like support that claim do you see any thing that might have caused that,Creating an agentic AI framework for observability
6,6_10,are you seeing being impacted do you have supporting metric to sort of like support that claim do you see any thing that might have caused that change recent deploys configuration change and this is all information that we can get in real time to help this operator figure out so can i snooze or do i really need to go deeper into this investigation for the payment service yeah i think thats a great use case because that come up a lot right in our customer who are doing real time transaction and they need to make sure that there no anomaly or they can stay ahead of a little bit of anomaly thats coming up it a lot of rich data thats out there but also talk a little bit about this go back to more of an ai ops kind of workflow to write once we get all this rich data were able to freeogit were able to present it to a customer in a more this could be an element of autonomous aspect versus assisted aspect can you talk a little bit about where doe autonomous or of ai agent could come in versus,Creating an agentic AI framework for observability
6,6_11,be an element of autonomous aspect versus assisted aspect can you talk a little bit about where doe autonomous or of ai agent could come in versus assisted yeah i think we want to give that control to the customer themselves so you can see this in sort of like different layer of autonomy the first layer maybe the most conservative is that the ai agent is just presenting a recommendation so it not really acting on it but it giving the operator enough information to say hey this is what this is my guidance kind of take it or leave it but a we get more complex and integrated with action that either agent can take on behalf of the user the user can also in their configuration set it to something less conservative so not only is the ai agent telling them what is the rationale for next step it also implementing those next step and you can see the most liberal would be it acting on your behalf and it just giving you a conclusion of what it did in the last sort of day or two and so with the,Creating an agentic AI framework for observability
6,6_12,the most liberal would be it acting on your behalf and it just giving you a conclusion of what it did in the last sort of day or two and so with the first release we definitely want to tread carefully we know ai agent are new people are cautious there fear of hallucination we really just want to summarize and give them the rationale for what is the conclusion that ha been made and then a we launch more more and more agent we feel a lot more comfortable in age two or 2026 we can sort of ladder up those capability awesome yeah that make sense all right so a we get towards the end of this podcast how are customer can keep up to date and even if they want to get involved in this new development what can they do yeah i would say that we are you know we have blog we have update from the sort of normal service now channel a were rolling out more and more ai agent across all of the use not just ai ops and item and definitely if you are interested in being a design partner we would love to,Creating an agentic AI framework for observability
6,6_13,more and more ai agent across all of the use not just ai ops and item and definitely if you are interested in being a design partner we would love to work with you to sort of figure out what is your use case and how we can build ai agent to solve your problem reduce mttr in your behalf awesome this wa just a kind of very snippet small snippet of what were working on and were going to bring you more of these kind of episode that you can get up to speed on also you can go to servicenowcom our main page is loaded with not a lot of new use case that we are working on youll get you up to speed and danika thank you for being here today and were going to get you back here soon when you have some agent out there working for our customer but yeah thanks a lot for being here thanks for everyone for listening in until the next episode bye for now thank you,Creating an agentic AI framework for observability
7,7_0,hi everyone welcome to another episode of the podcast im your host bobby brill and today were going to speak with the multimedia team the team that creates the multimedia bit the video and some of the infographics and all the graphic you see on the dock page and the youtube channel and our community channel that content that help you learn how service now work and were going to talk with macy douglas and dana haynes and im going to chime in myself a im on the multimedia team and were going to talk about how we make all that content to scale a quickly and efficiently and a perfect a possible for you the customer so dana tell u a little bit about your role here and all that you do to create a lot of the content we see well i help manage a vendor program where we are working with a third party vendor to help u create video and then also i run a program where we are training technical writer how to design visual content for their documentation page also macy im going to talk to you a well,Creating Multimedia Content at Scale with AI
7,7_1,a program where we are training technical writer how to design visual content for their documentation page also macy im going to talk to you a well but first introduce yourself and tell u a little bit about your role here okay my name is macy douglas and im a manager on the multimedia team ive been working with dana for the last seven year but ive been a part of service now for almost eight year now your expertise really is in the management and the workflow and youve got a really heavy strong knowledge of service now talk a little bit about how that came about since ive been with service now for almost eight year a lot of it ha come naturally just from working on various video on different product throughout the time of my eight year here ive been here since the helsinki release and one thing that i did here at service now wa i got really interested in the development of at the time it wa the drink your own champagne campaign we did internally and i kind of took our video asset,Creating Multimedia Content at Scale with AI
7,7_2,really interested in the development of at the time it wa the drink your own champagne campaign we did internally and i kind of took our video asset management that wa on a spreadsheet and put it onto service now so that really also just the self teaching that really helped me learn a lot about the service now platform itself and my name is bobby brill and ive been a video producer for the last 15 year and here now at service now im what we call a content producer so were helping to create the video develop the voice over program and help to create a visual representation of what the writer are putting down in the dock page a another learning tool to help solve customer issue so that they can use the product efficiently and effectively so macy give u a walk through on how were building video content because it not a simple a just setting up a camera and recording it a little bit different correct it actually the exact opposite we dont use any kind of camera to record anything all of,Creating Multimedia Content at Scale with AI
7,7_3,up a camera and recording it a little bit different correct it actually the exact opposite we dont use any kind of camera to record anything all of our video are done on the product itself we use we do screen demo product recording at least for this year our goal is to create over 400 piece of content whether thats a video an infographic or what we call procedure video 400 video thats a herkyl and feed so our customer really love video they want to see visual example in our documentation it something that theyre consistently asking for so macy walk u through a really the person who helping to push the content forward and helping to develop workflow and bringing all the piece together those little intricacy that help u to make the best multimedia content possible so the multimedia team is kind of like an inhouse video production team with the added benefit of we know service now so we produce content exclusively for the product documentation site and we also publish our content to the,Creating Multimedia Content at Scale with AI
7,7_4,the added benefit of we know service now so we produce content exclusively for the product documentation site and we also publish our content to the service now documentation youtube channel our team is made up of script writer who have a more traditional maybe they have a traditional background in writing or learning and then we have content producer who have a traditional background in video editing audio production video like live video production animation and then we have people on the team that are a little bit of both which is like which is something that dana specializes in shes really good at both thing so what we do is we create the video and infographics that help explain the various product that service now offer those get put on the documentation page and then like i said pushed out to youtube a well our goal this year is to create over 400 piece of content so whether that be we do infographics we do video that are around three to five minute that kind of explain an,Creating Multimedia Content at Scale with AI
